{
  "version": 1,
  "date": "2026-10-22",
  "opposition_id": "OPP-GSI",
  "topic_count": 57,
  "distribution": [
    10,
    16,
    15,
    16
  ],
  "question_totals": {
    "total": 1964,
    "active": 1964,
    "pending": 0,
    "by_origin": {
      "official": 202,
      "manual": 959,
      "ai": 803
    },
    "by_block": {
      "B1": 252,
      "B2": 760,
      "B4": 473,
      "B3": 479
    }
  },
  "topics": [
    {
      "topic_id": "B1-T01",
      "study_characters": 9024,
      "has_source": true,
      "questions": 25,
      "active": 25,
      "pending": 0,
      "minimum_met": true
    },
    {
      "topic_id": "B1-T02",
      "study_characters": 4957,
      "has_source": true,
      "questions": 22,
      "active": 22,
      "pending": 0,
      "minimum_met": true
    },
    {
      "topic_id": "B1-T03",
      "study_characters": 3118,
      "has_source": true,
      "questions": 24,
      "active": 24,
      "pending": 0,
      "minimum_met": true
    },
    {
      "topic_id": "B1-T04",
      "study_characters": 5755,
      "has_source": true,
      "questions": 22,
      "active": 22,
      "pending": 0,
      "minimum_met": true
    },
    {
      "topic_id": "B1-T05",
      "study_characters": 5351,
      "has_source": true,
      "questions": 26,
      "active": 26,
      "pending": 0,
      "minimum_met": true
    },
    {
      "topic_id": "B1-T06",
      "study_characters": 6143,
      "has_source": true,
      "questions": 23,
      "active": 23,
      "pending": 0,
      "minimum_met": true
    },
    {
      "topic_id": "B1-T07",
      "study_characters": 5876,
      "has_source": true,
      "questions": 24,
      "active": 24,
      "pending": 0,
      "minimum_met": true
    },
    {
      "topic_id": "B1-T08",
      "study_characters": 18511,
      "has_source": true,
      "questions": 37,
      "active": 37,
      "pending": 0,
      "minimum_met": true
    },
    {
      "topic_id": "B1-T09",
      "study_characters": 12883,
      "has_source": true,
      "questions": 23,
      "active": 23,
      "pending": 0,
      "minimum_met": true
    },
    {
      "topic_id": "B1-T10",
      "study_characters": 11675,
      "has_source": true,
      "questions": 26,
      "active": 26,
      "pending": 0,
      "minimum_met": true
    },
    {
      "topic_id": "B2-T01",
      "study_characters": 9598,
      "has_source": true,
      "questions": 84,
      "active": 84,
      "pending": 0,
      "minimum_met": true
    },
    {
      "topic_id": "B2-T02",
      "study_characters": 7677,
      "has_source": true,
      "questions": 88,
      "active": 88,
      "pending": 0,
      "minimum_met": true
    },
    {
      "topic_id": "B2-T03",
      "study_characters": 8188,
      "has_source": true,
      "questions": 22,
      "active": 22,
      "pending": 0,
      "minimum_met": true
    },
    {
      "topic_id": "B2-T04",
      "study_characters": 6610,
      "has_source": true,
      "questions": 24,
      "active": 24,
      "pending": 0,
      "minimum_met": true
    },
    {
      "topic_id": "B2-T05",
      "study_characters": 11185,
      "has_source": true,
      "questions": 24,
      "active": 24,
      "pending": 0,
      "minimum_met": true
    },
    {
      "topic_id": "B2-T06",
      "study_characters": 7267,
      "has_source": true,
      "questions": 22,
      "active": 22,
      "pending": 0,
      "minimum_met": true
    },
    {
      "topic_id": "B2-T07",
      "study_characters": 8866,
      "has_source": true,
      "questions": 21,
      "active": 21,
      "pending": 0,
      "minimum_met": true
    },
    {
      "topic_id": "B2-T08",
      "study_characters": 8239,
      "has_source": true,
      "questions": 25,
      "active": 25,
      "pending": 0,
      "minimum_met": true
    },
    {
      "topic_id": "B2-T09",
      "study_characters": 6169,
      "has_source": true,
      "questions": 84,
      "active": 84,
      "pending": 0,
      "minimum_met": true
    },
    {
      "topic_id": "B2-T10",
      "study_characters": 6164,
      "has_source": true,
      "questions": 22,
      "active": 22,
      "pending": 0,
      "minimum_met": true
    },
    {
      "topic_id": "B2-T11",
      "study_characters": 7426,
      "has_source": true,
      "questions": 23,
      "active": 23,
      "pending": 0,
      "minimum_met": true
    },
    {
      "topic_id": "B2-T12",
      "study_characters": 7076,
      "has_source": true,
      "questions": 24,
      "active": 24,
      "pending": 0,
      "minimum_met": true
    },
    {
      "topic_id": "B2-T13",
      "study_characters": 10384,
      "has_source": true,
      "questions": 26,
      "active": 26,
      "pending": 0,
      "minimum_met": true
    },
    {
      "topic_id": "B2-T14",
      "study_characters": 7184,
      "has_source": true,
      "questions": 163,
      "active": 163,
      "pending": 0,
      "minimum_met": true
    },
    {
      "topic_id": "B2-T15",
      "study_characters": 7804,
      "has_source": true,
      "questions": 24,
      "active": 24,
      "pending": 0,
      "minimum_met": true
    },
    {
      "topic_id": "B2-T16",
      "study_characters": 11679,
      "has_source": true,
      "questions": 84,
      "active": 84,
      "pending": 0,
      "minimum_met": true
    },
    {
      "topic_id": "B3-T01",
      "study_characters": 4685,
      "has_source": true,
      "questions": 26,
      "active": 26,
      "pending": 0,
      "minimum_met": true
    },
    {
      "topic_id": "B3-T02",
      "study_characters": 5521,
      "has_source": true,
      "questions": 24,
      "active": 24,
      "pending": 0,
      "minimum_met": true
    },
    {
      "topic_id": "B3-T03",
      "study_characters": 4088,
      "has_source": true,
      "questions": 22,
      "active": 22,
      "pending": 0,
      "minimum_met": true
    },
    {
      "topic_id": "B3-T04",
      "study_characters": 5074,
      "has_source": true,
      "questions": 24,
      "active": 24,
      "pending": 0,
      "minimum_met": true
    },
    {
      "topic_id": "B3-T05",
      "study_characters": 5835,
      "has_source": true,
      "questions": 24,
      "active": 24,
      "pending": 0,
      "minimum_met": true
    },
    {
      "topic_id": "B3-T06",
      "study_characters": 5528,
      "has_source": true,
      "questions": 25,
      "active": 25,
      "pending": 0,
      "minimum_met": true
    },
    {
      "topic_id": "B3-T07",
      "study_characters": 6486,
      "has_source": true,
      "questions": 22,
      "active": 22,
      "pending": 0,
      "minimum_met": true
    },
    {
      "topic_id": "B3-T08",
      "study_characters": 3696,
      "has_source": true,
      "questions": 23,
      "active": 23,
      "pending": 0,
      "minimum_met": true
    },
    {
      "topic_id": "B3-T09",
      "study_characters": 4378,
      "has_source": true,
      "questions": 24,
      "active": 24,
      "pending": 0,
      "minimum_met": true
    },
    {
      "topic_id": "B3-T10",
      "study_characters": 5100,
      "has_source": true,
      "questions": 25,
      "active": 25,
      "pending": 0,
      "minimum_met": true
    },
    {
      "topic_id": "B3-T11",
      "study_characters": 5030,
      "has_source": true,
      "questions": 143,
      "active": 143,
      "pending": 0,
      "minimum_met": true
    },
    {
      "topic_id": "B3-T12",
      "study_characters": 5198,
      "has_source": true,
      "questions": 25,
      "active": 25,
      "pending": 0,
      "minimum_met": true
    },
    {
      "topic_id": "B3-T13",
      "study_characters": 4827,
      "has_source": true,
      "questions": 24,
      "active": 24,
      "pending": 0,
      "minimum_met": true
    },
    {
      "topic_id": "B3-T14",
      "study_characters": 5628,
      "has_source": true,
      "questions": 24,
      "active": 24,
      "pending": 0,
      "minimum_met": true
    },
    {
      "topic_id": "B3-T15",
      "study_characters": 8117,
      "has_source": true,
      "questions": 24,
      "active": 24,
      "pending": 0,
      "minimum_met": true
    },
    {
      "topic_id": "B4-T01",
      "study_characters": 7047,
      "has_source": true,
      "questions": 21,
      "active": 21,
      "pending": 0,
      "minimum_met": true
    },
    {
      "topic_id": "B4-T02",
      "study_characters": 5499,
      "has_source": true,
      "questions": 22,
      "active": 22,
      "pending": 0,
      "minimum_met": true
    },
    {
      "topic_id": "B4-T03",
      "study_characters": 4932,
      "has_source": true,
      "questions": 22,
      "active": 22,
      "pending": 0,
      "minimum_met": true
    },
    {
      "topic_id": "B4-T04",
      "study_characters": 6063,
      "has_source": true,
      "questions": 23,
      "active": 23,
      "pending": 0,
      "minimum_met": true
    },
    {
      "topic_id": "B4-T05",
      "study_characters": 5234,
      "has_source": true,
      "questions": 25,
      "active": 25,
      "pending": 0,
      "minimum_met": true
    },
    {
      "topic_id": "B4-T06",
      "study_characters": 4963,
      "has_source": true,
      "questions": 24,
      "active": 24,
      "pending": 0,
      "minimum_met": true
    },
    {
      "topic_id": "B4-T07",
      "study_characters": 4390,
      "has_source": true,
      "questions": 22,
      "active": 22,
      "pending": 0,
      "minimum_met": true
    },
    {
      "topic_id": "B4-T08",
      "study_characters": 4129,
      "has_source": true,
      "questions": 21,
      "active": 21,
      "pending": 0,
      "minimum_met": true
    },
    {
      "topic_id": "B4-T09",
      "study_characters": 4206,
      "has_source": true,
      "questions": 22,
      "active": 22,
      "pending": 0,
      "minimum_met": true
    },
    {
      "topic_id": "B4-T10",
      "study_characters": 3989,
      "has_source": true,
      "questions": 25,
      "active": 25,
      "pending": 0,